{
  "name": "Chat with Postgresql Database",
  "workflowSlug": "chat-with-postgresql-database",
  "description": "This workflow enables an AI assistant to chat with a PostgreSQL database, allowing users to query and retrieve data using natural language. It supports custom SQL queries and schema introspection.",
  "isPublic": true,
  "nodes": [
    {
      "nodeId": "node_71ecfe07c4",
      "actorId": "actor_71ecfe07c4",
      "type": "NodeStart",
      "label": "Start",
      "color": "#22C55E",
      "position": {
        "x": 80,
        "y": 100
      },
      "size": {
        "width": 240,
        "height": 100
      }
    },
    {
      "nodeId": "node_e294b60ae5",
      "actorId": "actor_e294b60ae5",
      "type": "NodeCdecliAgent",
      "label": "AI Agent",
      "color": "#8B5CF6",
      "position": {
        "x": 460,
        "y": 100
      },
      "size": {
        "width": 320,
        "height": 260
      },
      "inputs": {
        "model": "gpt-4o-mini",
        "sessionId": "{{sessionId}}",
        "system": "You are DB assistant. You need to run queries in DB aligned with user requests.\n\nRun custom SQL query to aggregate data and response to user. Make sure every table has schema prefix to it in sql query which you can get from `Get DB Schema and Tables List` tool.\n\nFetch all data to analyse it for response if needed.\n\n## Tools\n\n- Execute SQL query - Executes any sql query generated by AI\n- Get DB Schema and Tables List - Lists all the tables in database with its schema name\n- Get Table Definition - Gets the table definition from db using table name and schema name",
        "message": "{{chatInput}}"
      }
    },
    {
      "nodeId": "node_46b43a551d",
      "actorId": "actor_46b43a551d",
      "type": "NodeEnd",
      "label": "End",
      "color": "#EF4444",
      "position": {
        "x": 840,
        "y": 100
      },
      "size": {
        "width": 240,
        "height": 100
      }
    },
    {
      "nodeId": "node_cd9f148f3b",
      "actorId": "actor_cd9f148f3b",
      "type": "NodeWorkflowConfigs",
      "label": "Workflow Configs",
      "color": "default",
      "position": {
        "x": 80,
        "y": 360
      },
      "size": {
        "width": 280,
        "height": 200
      },
      "inputs": {
        "projectId": "",
        "environmentTagId": "",
        "initialContext": {
          "chatInput": "",
          "sessionId": ""
        }
      }
    }
  ],
  "edges": [
    {
      "source": "node_71ecfe07c4",
      "target": "node_e294b60ae5",
      "sourceOutput": "trigger",
      "targetInput": "RUN",
      "sourceNodeType": "NodeStart",
      "targetNodeType": "NodeCdecliAgent"
    },
    {
      "source": "node_e294b60ae5",
      "target": "node_46b43a551d",
      "sourceOutput": "text",
      "targetInput": "result",
      "sourceNodeType": "NodeCdecliAgent",
      "targetNodeType": "NodeEnd"
    }
  ],
  "template": {
    "schemaVersion": 2,
    "category": "database-and-storage",
    "categoryLabel": "Database and Storage",
    "department": "Data Analytics",
    "connectors": [
      "supabase"
    ],
    "nodeTypes": [
      "NodeCdecliAgent",
      "NodeEnd",
      "NodeStart",
      "NodeWorkflowConfigs"
    ],
    "comparison": {
      "n8nSteps": 7,
      "yantraSteps": 2,
      "foldedHelpers": [
        "OpenAI Chat Model",
        "Chat History",
        "Execute SQL Query",
        "Get Table Definition",
        "Get DB Schema and Tables List"
      ]
    },
    "source": {
      "repo": "https://github.com/enescingoz/awesome-n8n-templates",
      "path": "Database_and_Storage/Chat with Postgresql Database.json",
      "commit": "827110332c21cbe000ab13f6d292d5adb1f1f8db",
      "n8nName": "Chat with Postgresql Database"
    },
    "tier": "ready",
    "blockers": [
      {
        "code": "trigger-replaced",
        "node": "When chat message received",
        "detail": "@n8n/n8n-nodes-langchain.chatTrigger became the Start node"
      }
    ],
    "setup": [
      "\"When chat message received\" (chatTrigger) started the original; run this workflow on demand, through the workflow API, or add a schedule.",
      "Connect the supabase connector (credential).",
      "Provide run inputs: chatInput, sessionId."
    ],
    "conversion": {
      "tool": "scripts/convert-n8n.mjs",
      "status": "ready",
      "coverage": 1,
      "unmapped": [],
      "approximate": [],
      "folded": [
        {
          "node": "OpenAI Chat Model",
          "type": "@n8n/n8n-nodes-langchain.lmChatOpenAi",
          "into": "AI Agent",
          "model": "gpt-4o-mini"
        },
        {
          "node": "Chat History",
          "type": "@n8n/n8n-nodes-langchain.memoryBufferWindow",
          "into": "AI Agent",
          "as": "ai_memory"
        },
        {
          "node": "Execute SQL Query",
          "type": "n8n-nodes-base.postgresTool",
          "into": "AI Agent",
          "as": "ai_tool"
        },
        {
          "node": "Get Table Definition",
          "type": "n8n-nodes-base.postgresTool",
          "into": "AI Agent",
          "as": "ai_tool"
        },
        {
          "node": "Get DB Schema and Tables List",
          "type": "n8n-nodes-base.postgresTool",
          "into": "AI Agent",
          "as": "ai_tool"
        }
      ],
      "removedEdges": [],
      "triggers": [
        {
          "node": "When chat message received",
          "type": "@n8n/n8n-nodes-langchain.chatTrigger",
          "as": "NodeStart"
        }
      ],
      "hints": [
        "Provide `chatInput` (and optionally `sessionId`) as run inputs; the original started from a chat message.",
        "\"AI Agent\" kept conversation memory (memoryBufferWindow); sessionId is set to the run-input sessionId.",
        "\"AI Agent\" used agent tools in the original: Execute SQL Query (postgresTool), Get Table Definition (postgresTool), Get DB Schema and Tables List (postgresTool). The cdecli agent calls connectors directly; connect credentials for the services those tools reached. Prefer connectors: supabase.",
        "Select the Project and Environment on the Workflow Configs node (the ids from `cdecli auth status`), then connect a credential for each connector below.",
        "Connect supabase: `cdecli credential create -n \"supabase\" -p supabase --template <formId> --secret <key>=<value>` (see `cdecli credential templates`)."
      ]
    },
    "notes": [
      "### 👨‍🎤 Setup\n1. Add your **postgresql** and **OpenAI** credentials.\n2. Click **Chat** button and start asking questions to your database.\n3. Activate the workflow and you can make the chat publicly available.",
      "🛠️ Tools Used:\n1. Execute SQL Query: Used to execute any query generated by the agent.\n2. Get DB Schema and Tables List: It returns the list of all the tables with its schema name.\n3. Get Table Definition: It returns table details like column names, foreign keys and more of a particular table in a schema.",
      "👆 You can exchange this with any other chat model of your choice.",
      "👆 You can change how many number of messages to keep using `Context Window Length` option. It's 5 by default."
    ],
    "nodes": {
      "node_71ecfe07c4": {
        "n8n": "When chat message received",
        "n8nType": "@n8n/n8n-nodes-langchain.chatTrigger"
      },
      "node_e294b60ae5": {
        "n8n": "AI Agent",
        "n8nType": "@n8n/n8n-nodes-langchain.agent"
      },
      "node_46b43a551d": {
        "n8n": "__end:AI Agent",
        "n8nType": "synthetic"
      },
      "node_cd9f148f3b": {
        "n8n": "__configs",
        "n8nType": "synthetic"
      }
    }
  }
}
