{
  "name": "Integrating AI with Open-Meteo API",
  "workflowSlug": "integrating-ai-with-open-meteo-api",
  "description": "Enhances weather forecasting with AI analysis.",
  "isPublic": true,
  "nodes": [
    {
      "nodeId": "node_7e9fabc3f0",
      "actorId": "actor_7e9fabc3f0",
      "type": "NodeStart",
      "label": "Start",
      "color": "#22C55E",
      "position": {
        "x": 80,
        "y": 100
      },
      "size": {
        "width": 240,
        "height": 100
      }
    },
    {
      "nodeId": "node_70794f1fd4",
      "actorId": "actor_70794f1fd4",
      "type": "NodeCdecliAgent",
      "label": "Generic AI Tool Agent",
      "color": "#8B5CF6",
      "position": {
        "x": 460,
        "y": 100
      },
      "size": {
        "width": 320,
        "height": 260
      },
      "inputs": {
        "sessionId": "{{sessionId}}",
        "message": "{{chatInput}}"
      }
    },
    {
      "nodeId": "node_35656435dd",
      "actorId": "actor_35656435dd",
      "type": "NodeEnd",
      "label": "End",
      "color": "#EF4444",
      "position": {
        "x": 840,
        "y": 100
      },
      "size": {
        "width": 240,
        "height": 100
      }
    },
    {
      "nodeId": "node_f7e3d85ae6",
      "actorId": "actor_f7e3d85ae6",
      "type": "NodeWorkflowConfigs",
      "label": "Workflow Configs",
      "color": "default",
      "position": {
        "x": 80,
        "y": 360
      },
      "size": {
        "width": 280,
        "height": 200
      },
      "inputs": {
        "projectId": "",
        "environmentTagId": "",
        "initialContext": {
          "chatInput": "",
          "sessionId": ""
        }
      }
    }
  ],
  "edges": [
    {
      "source": "node_7e9fabc3f0",
      "target": "node_70794f1fd4",
      "sourceOutput": "trigger",
      "targetInput": "RUN",
      "sourceNodeType": "NodeStart",
      "targetNodeType": "NodeCdecliAgent"
    },
    {
      "source": "node_70794f1fd4",
      "target": "node_35656435dd",
      "sourceOutput": "text",
      "targetInput": "result",
      "sourceNodeType": "NodeCdecliAgent",
      "targetNodeType": "NodeEnd"
    }
  ],
  "template": {
    "schemaVersion": 2,
    "category": "other-integrations",
    "categoryLabel": "Other Integrations and Use Cases",
    "department": "Data Science/Weather",
    "connectors": [],
    "nodeTypes": [
      "NodeCdecliAgent",
      "NodeEnd",
      "NodeStart",
      "NodeWorkflowConfigs"
    ],
    "comparison": {
      "n8nSteps": 6,
      "yantraSteps": 2,
      "foldedHelpers": [
        "OpenAI Chat Model",
        "Chat Memory Buffer",
        "A tool for inputting the city and obtaining geolocation",
        "A tool to get the weather forecast based on geolocation"
      ]
    },
    "source": {
      "repo": "https://github.com/enescingoz/awesome-n8n-templates",
      "path": "Other_Integrations_and_Use_Cases/Integrating AI with Open-Meteo API for Enhanced Weather Forecasting.json",
      "commit": "827110332c21cbe000ab13f6d292d5adb1f1f8db",
      "n8nName": "Integrating AI with Open-Meteo API for Enhanced Weather Forecasting"
    },
    "tier": "ready",
    "blockers": [
      {
        "code": "trigger-replaced",
        "node": "When chat message received",
        "detail": "@n8n/n8n-nodes-langchain.chatTrigger became the Start node"
      }
    ],
    "setup": [
      "\"When chat message received\" (chatTrigger) started the original; run this workflow on demand, through the workflow API, or add a schedule.",
      "Provide run inputs: chatInput, sessionId."
    ],
    "conversion": {
      "tool": "scripts/convert-n8n.mjs",
      "status": "ready",
      "coverage": 1,
      "unmapped": [],
      "approximate": [],
      "folded": [
        {
          "node": "OpenAI Chat Model",
          "type": "@n8n/n8n-nodes-langchain.lmChatOpenAi",
          "into": "Generic AI Tool Agent"
        },
        {
          "node": "Chat Memory Buffer",
          "type": "@n8n/n8n-nodes-langchain.memoryBufferWindow",
          "into": "Generic AI Tool Agent",
          "as": "ai_memory"
        },
        {
          "node": "A tool for inputting the city and obtaining geolocation",
          "type": "@n8n/n8n-nodes-langchain.toolHttpRequest",
          "into": "Generic AI Tool Agent",
          "as": "ai_tool"
        },
        {
          "node": "A tool to get the weather forecast based on geolocation",
          "type": "@n8n/n8n-nodes-langchain.toolHttpRequest",
          "into": "Generic AI Tool Agent",
          "as": "ai_tool"
        }
      ],
      "removedEdges": [],
      "triggers": [
        {
          "node": "When chat message received",
          "type": "@n8n/n8n-nodes-langchain.chatTrigger",
          "as": "NodeStart"
        }
      ],
      "hints": [
        "Provide `chatInput` (and optionally `sessionId`) as run inputs; the original started from a chat message.",
        "\"Generic AI Tool Agent\" kept conversation memory (memoryBufferWindow); sessionId is set to the run-input sessionId.",
        "\"Generic AI Tool Agent\" used agent tools in the original: A tool for inputting the city and obtaining geolocation (toolHttpRequest), A tool to get the weather forecast based on geolocation (toolHttpRequest). The cdecli agent calls connectors directly; connect credentials for the services those tools reached.",
        "Select the Project and Environment on the Workflow Configs node (the ids from `cdecli auth status`), then connect a credential for each connector below."
      ]
    },
    "notes": [
      "## Integrating AI with Open-Meteo API for Enhanced Weather Forecasting\n\n## Use case\n\n### Workshop\n\nWe are using this workflow in our workshops to teach how to use Tools a.k.a functions with artificial intelligence. In this specific case, we will use a generic \"AI Agent\" node to illustrate that it could use other models from different data providers.\n\n### Enhanced Weather Forecasting\n\nIn this small example, it's easy to demonstrate how to obtain weather forecast results from the Open-Meteo site to accurately display the upcoming days.\n\nThis can be used to plan travel decisions, for example.\n\n## What this workflow does\n\n1. We will make an HTTP request to find out the geographic coordinates of a city.\n2. Then, we will make other HTTP requests to discover the weather for the upcoming days.\n\nIn this workshop, we demonstrate that the AI will be able to determine which tool to call first-it will first call the geolocation tool and then the weather forecast tool. All of this within a single client conversation call.\n\n\n## Setup\n\nInsert an OpenAI Key and activate the workflow.\n\nby Davi Saranszky Mesquita\nhttps://www.linkedin.com/in/mesquitadavi/",
      "## Create an Hosted Web Chat\n\n### And setup the trigger!\n\nExample: https://website/webhook/4a4..../chat",
      "-\n\n\n## Setup OpenAI Key",
      "### Open Meteo SPEC - City Geolocation\n\nThis tool will go to the URL https://geocoding-api.open-meteo.com/v1/search to fetch the geolocation data of the city, and I only need to get the name of the city.\n\nSo, I will ask the user to input the name of the city and pass some pre-existing information, such as returning only the first city and returning in JSON format.\n\n- name (By Model) - And placeholder - The parameter that the AI will need to fill in as required.\n\n- count - 1 by default because I want only the first city.\n\n- format - Putting JSON for no specific reason, but OpenAI could figure out how to process that information.",
      "### Open Meteo SPEC - Weather Forecast\n\nThis tool will go to the Open Meteo site with the geolocation information at https://api.open-meteo.com/v1/forecast\n\nIt will pass the information on latitude, longitude, and the number of days for which it will bring data.\n\nThere are many default pieces of information within, but the focus is not to explain the Open Meteo API.\n\nVariables like latitude, longitude, and forecast_days are self-explanatory for OpenAI, making it the easiest tool to configure.\n\n- latitude (By Model) and Placeholder\n- longitude (By Model) and Placeholder\n- forecast_days (By Model) and Placeholder",
      "## Within N8N, there will be a chat button to test, or you can use the external chat link from the trigger."
    ],
    "nodes": {
      "node_7e9fabc3f0": {
        "n8n": "When chat message received",
        "n8nType": "@n8n/n8n-nodes-langchain.chatTrigger"
      },
      "node_70794f1fd4": {
        "n8n": "Generic AI Tool Agent",
        "n8nType": "@n8n/n8n-nodes-langchain.agent"
      },
      "node_35656435dd": {
        "n8n": "__end:Generic AI Tool Agent",
        "n8nType": "synthetic"
      },
      "node_f7e3d85ae6": {
        "n8n": "__configs",
        "n8nType": "synthetic"
      }
    }
  }
}
