{
  "name": "Issue a Verifiable Certificate (Attestify API)",
  "workflowSlug": "issue-a-verifiable-certificate-attestify-api",
  "description": "POST recipient and course data to a free API and receive a permanent, tamper-evident public verify page (Ed25519-signed - change one character and verification fails). Core HTTP node; no API key, no signup.",
  "isPublic": true,
  "nodes": [
    {
      "nodeId": "node_5c99f0732f",
      "actorId": "actor_5c99f0732f",
      "type": "NodeStart",
      "label": "Start",
      "color": "#22C55E",
      "position": {
        "x": 80,
        "y": 100
      },
      "size": {
        "width": 240,
        "height": 100
      }
    },
    {
      "nodeId": "node_df86c6d959",
      "actorId": "actor_df86c6d959",
      "type": "NodeHttpRequest",
      "label": "Issue certificate (Attestify)",
      "color": "#0EA5E9",
      "position": {
        "x": 460,
        "y": 100
      },
      "size": {
        "width": 280,
        "height": 220
      },
      "inputs": {
        "method": "POST",
        "url": "https://attestify.novadyne.ai/cert/issue",
        "headers": {
          "Content-Type": "application/json"
        },
        "body": "{\n  \"issuer\": \"Acme Automation Academy\",\n  \"course\": \"Advanced Workflow Automation 2026\",\n  \"recipients\": [\n    {\n      \"name\": \"Jane Doe\",\n      \"email\": \"jane@example.com\"\n    }\n  ]\n}"
      }
    },
    {
      "nodeId": "node_af6baaeaba",
      "actorId": "actor_af6baaeaba",
      "type": "NodeEnd",
      "label": "End",
      "color": "#EF4444",
      "position": {
        "x": 840,
        "y": 100
      },
      "size": {
        "width": 240,
        "height": 100
      }
    },
    {
      "nodeId": "node_ccc00d66ca",
      "actorId": "actor_ccc00d66ca",
      "type": "NodeWorkflowConfigs",
      "label": "Workflow Configs",
      "color": "default",
      "position": {
        "x": 80,
        "y": 360
      },
      "size": {
        "width": 280,
        "height": 200
      },
      "inputs": {
        "projectId": "",
        "environmentTagId": ""
      }
    }
  ],
  "edges": [
    {
      "source": "node_5c99f0732f",
      "target": "node_df86c6d959",
      "sourceOutput": "trigger",
      "targetInput": "RUN",
      "sourceNodeType": "NodeStart",
      "targetNodeType": "NodeHttpRequest"
    },
    {
      "source": "node_df86c6d959",
      "target": "node_af6baaeaba",
      "sourceOutput": "body",
      "targetInput": "result",
      "sourceNodeType": "NodeHttpRequest",
      "targetNodeType": "NodeEnd"
    }
  ],
  "template": {
    "schemaVersion": 2,
    "category": "other-integrations",
    "categoryLabel": "Other Integrations and Use Cases",
    "department": "Education/Ops",
    "connectors": [],
    "nodeTypes": [
      "NodeEnd",
      "NodeHttpRequest",
      "NodeStart",
      "NodeWorkflowConfigs"
    ],
    "comparison": {
      "n8nSteps": 2,
      "yantraSteps": 2,
      "foldedHelpers": []
    },
    "source": {
      "repo": "https://github.com/enescingoz/awesome-n8n-templates",
      "path": "Other_Integrations_and_Use_Cases/Issue a verifiable certificate (Attestify).json",
      "commit": "827110332c21cbe000ab13f6d292d5adb1f1f8db",
      "n8nName": "Issue a verifiable certificate (Attestify)"
    },
    "tier": "ready",
    "blockers": [],
    "setup": [],
    "conversion": {
      "tool": "scripts/convert-n8n.mjs",
      "status": "ready",
      "coverage": 1,
      "unmapped": [],
      "approximate": [],
      "folded": [],
      "removedEdges": [],
      "triggers": [
        {
          "node": "When clicking 'Execute workflow'",
          "type": "n8n-nodes-base.manualTrigger",
          "as": "NodeStart"
        }
      ],
      "hints": [
        "Select the Project and Environment on the Workflow Configs node (the ids from `cdecli auth status`), then connect a credential for each connector below."
      ]
    },
    "notes": [],
    "nodes": {
      "node_5c99f0732f": {
        "n8n": "When clicking 'Execute workflow'",
        "n8nType": "n8n-nodes-base.manualTrigger"
      },
      "node_df86c6d959": {
        "n8n": "Issue certificate (Attestify)",
        "n8nType": "n8n-nodes-base.httpRequest"
      },
      "node_af6baaeaba": {
        "n8n": "__end:Issue certificate (Attestify)",
        "n8nType": "synthetic"
      },
      "node_ccc00d66ca": {
        "n8n": "__configs",
        "n8nType": "synthetic"
      }
    }
  }
}
