{
  "name": "[AI/LangChain] Output Parser 4",
  "workflowSlug": "ai-langchain-output-parser-4",
  "description": "Converted from the n8n template \"[AI/LangChain] Output Parser 4\".",
  "isPublic": true,
  "nodes": [
    {
      "nodeId": "node_9f262f7ec3",
      "actorId": "actor_9f262f7ec3",
      "type": "NodeStart",
      "label": "Start",
      "color": "#22C55E",
      "position": {
        "x": 80,
        "y": 100
      },
      "size": {
        "width": 240,
        "height": 100
      }
    },
    {
      "nodeId": "node_be17aa9fd3",
      "actorId": "actor_be17aa9fd3",
      "type": "NodeLlmChain",
      "label": "LLM Chain",
      "color": "#8B5CF6",
      "position": {
        "x": 460,
        "y": 100
      },
      "size": {
        "width": 320,
        "height": 260
      },
      "inputs": {
        "schema": {
          "type": "object",
          "properties": {
            "states": {
              "type": "array",
              "minItems": 5,
              "maxItems": 5,
              "items": {
                "type": "object",
                "properties": {
                  "state": {
                    "type": "string"
                  },
                  "cities": {
                    "type": "array",
                    "minItems": 3,
                    "maxItems": 3,
                    "items": {
                      "type": "object",
                      "properties": {
                        "name": {
                          "type": "string"
                        },
                        "population": {
                          "type": "integer",
                          "minimum": 0
                        }
                      },
                      "required": [
                        "name",
                        "population"
                      ],
                      "additionalProperties": false
                    }
                  }
                },
                "required": [
                  "state",
                  "cities"
                ],
                "additionalProperties": false
              }
            }
          },
          "required": [
            "states"
          ],
          "additionalProperties": false
        },
        "prompt": "{{input}}",
        "outputMode": "structured",
        "schemaMode": "prompt"
      }
    },
    {
      "nodeId": "node_3fab1cfde2",
      "actorId": "actor_3fab1cfde2",
      "type": "NodeEnd",
      "label": "End",
      "color": "#EF4444",
      "position": {
        "x": 840,
        "y": 100
      },
      "size": {
        "width": 240,
        "height": 100
      }
    },
    {
      "nodeId": "node_ef7467af5c",
      "actorId": "actor_ef7467af5c",
      "type": "NodeWorkflowConfigs",
      "label": "Workflow Configs",
      "color": "default",
      "position": {
        "x": 80,
        "y": 360
      },
      "size": {
        "width": 280,
        "height": 200
      },
      "inputs": {
        "projectId": "",
        "environmentTagId": "",
        "iteratingInitialContexts": [
          {
            "input": "Return the 5 largest states by area in the USA with their 3 largest cities and their population."
          },
          {
            "input": "Return the 5 most populous states in the USA with their 3 largest cities by population and each city's population."
          },
          {
            "input": "Return the 5 smallest states by area in the USA with their 3 largest cities by population and each city's population."
          }
        ],
        "initialContextMaxConcurrency": 3
      }
    },
    {
      "nodeId": "node_2240010a97",
      "actorId": "actor_2240010a97",
      "type": "NodeChatModel",
      "label": "LLM Chain: model",
      "color": "#8B5CF6",
      "position": {
        "x": 460,
        "y": 420
      },
      "size": {
        "width": 280,
        "height": 220
      },
      "inputs": {
        "provider": "openai",
        "model": "gpt-4o-mini"
      }
    }
  ],
  "edges": [
    {
      "source": "node_9f262f7ec3",
      "target": "node_be17aa9fd3",
      "sourceOutput": "trigger",
      "targetInput": "RUN",
      "sourceNodeType": "NodeStart",
      "targetNodeType": "NodeLlmChain"
    },
    {
      "source": "node_be17aa9fd3",
      "target": "node_3fab1cfde2",
      "sourceOutput": "object",
      "targetInput": "result",
      "sourceNodeType": "NodeLlmChain",
      "targetNodeType": "NodeEnd"
    },
    {
      "source": "node_2240010a97",
      "target": "node_be17aa9fd3",
      "sourceOutput": "config",
      "targetInput": "llm",
      "sourceNodeType": "NodeChatModel",
      "targetNodeType": "NodeLlmChain"
    }
  ],
  "template": {
    "schemaVersion": 2,
    "category": "openai-and-llms",
    "categoryLabel": "OpenAI and LLMs",
    "department": "",
    "connectors": [
      "openai"
    ],
    "nodeTypes": [
      "NodeChatModel",
      "NodeEnd",
      "NodeLlmChain",
      "NodeStart",
      "NodeWorkflowConfigs"
    ],
    "comparison": {
      "n8nSteps": 7,
      "yantraSteps": 3,
      "foldedHelpers": [
        "OpenAI Chat Model",
        "Auto-fixing Output Parser"
      ]
    },
    "source": {
      "repo": "https://github.com/enescingoz/awesome-n8n-templates",
      "path": "OpenAI_and_LLMs/Force AI to use a specific output format.json",
      "commit": "827110332c21cbe000ab13f6d292d5adb1f1f8db",
      "n8nName": "[AI/LangChain] Output Parser 4"
    },
    "tier": "ready",
    "blockers": [],
    "setup": [
      "Connect the openai connector (credential).",
      "Provide run inputs: input."
    ],
    "conversion": {
      "tool": "hand",
      "status": "ready",
      "coverage": 1,
      "unmapped": [],
      "approximate": [],
      "folded": [
        {
          "node": "OpenAI Chat Model",
          "type": "@n8n/n8n-nodes-langchain.lmChatOpenAi",
          "into": "LLM Chain"
        },
        {
          "node": "Auto-fixing Output Parser",
          "type": "@n8n/n8n-nodes-langchain.outputParserAutofixing",
          "into": "LLM Chain",
          "as": "ai_outputParser"
        }
      ],
      "removedEdges": [],
      "triggers": [
        {
          "node": "When clicking \"Execute Workflow\"",
          "type": "n8n-nodes-base.manualTrigger",
          "as": "NodeStart"
        }
      ],
      "hints": [
        "Select the Project and Environment on the Workflow Configs node (the ids from `cdecli auth status`), then connect a credential for each connector below.",
        "Maintained directly in this template: each run reads its own input from the three example contexts in Workflow Configs.",
        "The inline LLM Chain schema requires five states with three cities each, correcting the upstream schema that described only one state."
      ]
    },
    "notes": [
      "### Parser which defines the output format and which gets used to validate the output",
      "### The LLM which gets used to try to autofix the output in case it was not valid",
      "### The LLM to process the original prompt",
      "### Autofixing parser which tries to fix invalid outputs with the help of an LLM"
    ],
    "nodes": {
      "node_9f262f7ec3": {
        "n8n": "When clicking \"Execute Workflow\"",
        "n8nType": "n8n-nodes-base.manualTrigger"
      },
      "node_be17aa9fd3": {
        "n8n": "LLM Chain",
        "n8nType": "@n8n/n8n-nodes-langchain.chainLlm"
      },
      "node_3fab1cfde2": {
        "n8n": "__end:LLM Chain",
        "n8nType": "synthetic"
      },
      "node_ef7467af5c": {
        "n8n": "__configs",
        "n8nType": "synthetic"
      },
      "node_2240010a97": {
        "n8n": "LLM Chain",
        "n8nType": "synthetic",
        "role": "chat-model"
      }
    }
  }
}
